{
  "provider": "snyk",
  "capability": "vulnerability_scanner",
  "transport": {
    "kind": "mcp",
    "server": "snyk"
  },
  "userConfigKeys": [
    "snykToken",
    "snykOrg"
  ],
  "title": "snyk",
  "description": "snyk as vulnerability_scanner provider, supplied by polymath-connector-snyk."
}
