{
  "provider": "datadog",
  "capability": "observability",
  "transport": {
    "kind": "mcp",
    "server": "datadog"
  },
  "userConfigKeys": [
    "datadogApiKey",
    "datadogAppKey",
    "datadogSite"
  ],
  "title": "datadog",
  "description": "datadog as observability provider, supplied by polymath-connector-observability."
}
