{
  "provider": "jira",
  "capability": "issue_tracker",
  "transport": {
    "kind": "mcp",
    "server": "jira"
  },
  "userConfigKeys": [
    "jiraUrl",
    "jiraEmail",
    "jiraApiToken"
  ],
  "title": "jira",
  "description": "jira as issue_tracker provider, supplied by polymath-connector-tracker."
}
