{
  "provider": "dependabot",
  "capability": "vulnerability_scanner",
  "transport": {
    "kind": "mcp",
    "server": "github"
  },
  "userConfigKeys": [
    "githubToken"
  ],
  "title": "dependabot",
  "description": "dependabot as vulnerability_scanner provider, supplied by polymath-connector-github."
}
